{"schema_version":1,"authority":{"kind":"coordinator","tenant_id":"tenant-7"},"command_id":"cmd-create-01","payload_digest":"aaaaaaaaaaaaaaaaaaaaaaaaaaaaaaaaaaaaaaaaaaaaaaaaaaaaaaaaaaaaaaaa","submission_fingerprint":"bbbbbbbbbbbbbbbbbbbbbbbbbbbbbbbbbbbbbbbbbbbbbbbbbbbbbbbbbbbbbbbb","receipt_state":"coordinator_stored","stored_at_unix_ms":1700000000000,"assigned_target":{"task_id":"task-created-42"}}
